{"$schema":"https://json-schema.org/draft/2020-12/schema","$id":"https://qualityreporter.dev/schemas/quality-config.schema.json","title":"QualityReporter v1.1 configuration","type":"object","additionalProperties":false,"properties":{"historyDays":{"type":"integer"},"reworkWindowDays":{"type":"integer"},"exclude":{"type":"array"},"coupling":{"type":"object"},"fileMaturity":{"type":"object"},"activityWeights":{"type":"object"},"riskWeights":{"type":"object"},"classification":{"type":"object"},"functions":{"type":"object"},"report":{"type":"object"}}}
